{
  "brief_id": "type-tips",
  "language": "ko",
  "slides": [
    {
      "slide_id": "s1",
      "purpose": "hook",
      "headline": "읽히는 디자인의 시작",
      "body": "크기와 여백으로 중요한 메시지를 먼저 보여주세요.",
      "claims": []
    },
    {
      "slide_id": "s2",
      "purpose": "application",
      "headline": "위계를 먼저 정해보세요",
      "body": "제목은 크게, 설명은 짧게. 중요한 문장 주변에 여백을 두세요.",
      "cta": "다음 작업에 쓰도록 저장하세요.",
      "claims": []
    }
  ],
  "assumptions": [
    "사용자 레퍼런스가 없어 크림색 배경과 검정 타이포 방향을 임시 제안한다."
  ]
}
